{
  "id": "btn-secondary-lg",
  "name": "Secondary Button / LG",
  "group": "button",
  "tags": [
    "보조액션",
    "외곽선형"
  ],
  "spec": {
    "width": "hug",
    "height": "control.lg.height",
    "radius": "lg",
    "paddingX": "control.lg.paddingX",
    "borderWidth": "border.width",
    "typography": "body1-bold"
  },
  "tokens": {
    "border": "border.default",
    "label": "text.primary",
    "bg": "surface.default"
  },
  "responsive": {
    "sm": "fill"
  },
  "states": [
    "default",
    "hover",
    "pressed",
    "disabled"
  ],
  "usage": "주요 액션과 나란히 놓는 두 번째 선택지",
  "dont": "단독으로 쓰지 않음. 항상 primary와 짝",
  "status": "stable",
  "since": "v1.0.0",
  "renders": {
    "eluo": "assets/components/button/btn-secondary-lg--eluo@2x.png",
    "atlas": "assets/components/button/btn-secondary-lg--atlas@2x.png",
    "ember": "assets/components/button/btn-secondary-lg--ember@2x.png",
    "harbor": "assets/components/button/btn-secondary-lg--harbor@2x.png",
    "tideland": "assets/components/button/btn-secondary-lg--tideland@2x.png",
    "cobalt": "assets/components/button/btn-secondary-lg--cobalt@2x.png",
    "noir": "assets/components/button/btn-secondary-lg--noir@2x.png"
  }
}
