{
  "id": "stepper-md",
  "name": "Stepper / MD",
  "group": "booking",
  "tags": [
    "예약",
    "인원",
    "수량"
  ],
  "spec": {
    "buttonSize": "booking.stepperSize",
    "valueWidth": "booking.stepperValueWidth",
    "gap": "booking.stepperGap",
    "radius": "sm",
    "borderWidth": "border.width",
    "typography": "body1-bold"
  },
  "tokens": {
    "border": "border.default",
    "icon": "text.primary",
    "value": "text.primary",
    "disabled": "text.disabled"
  },
  "responsive": {},
  "states": [
    "default",
    "최소값(감소 비활성)",
    "최대값(증가 비활성)"
  ],
  "usage": "객실 수·성인·어린이처럼 작은 정수를 세는 자리",
  "dont": "열을 넘길 수 있는 값에는 쓰지 않음. 그때는 select 로",
  "status": "stable",
  "since": "v1.13.0",
  "pack": "hotel",
  "renders": {
    "linen": "assets/components/booking/stepper-md--linen@2x.png"
  }
}
