{
  "id": "cart-summary-lg",
  "name": "Cart Summary / LG",
  "group": "commerce",
  "tags": [
    "커머스",
    "장바구니",
    "결제"
  ],
  "spec": {
    "width": "cart.width",
    "paddingX": "cart.paddingX",
    "paddingY": "cart.paddingY",
    "rowGap": "cart.rowGap",
    "totalGap": "cart.totalGap",
    "radius": "xl",
    "borderWidth": "border.width",
    "titleTypography": "heading3",
    "rowTypography": "body2",
    "totalTypography": "heading3",
    "actionHeight": "control.lg.height"
  },
  "tokens": {
    "bg": "surface.default",
    "border": "border.subtle",
    "title": "text.primary",
    "key": "text.secondary",
    "value": "text.primary",
    "discount": "text.brand",
    "total": "text.brand",
    "divider": "border.subtle",
    "actionBg": "brand.primary",
    "actionLabel": "text.inverse"
  },
  "responsive": {},
  "states": [
    "default",
    "할인 없음",
    "결제 비활성(필수 동의 전)"
  ],
  "usage": "장바구니·주문서에서 낼 돈을 확정하는 자리. 상품 금액 · 배송비 · 할인 · 총액 순서를 바꾸지 않음",
  "dont": "총액을 다른 줄과 같은 활자로 두지 않음 — 어느 것이 낼 돈인지 알 수 없음. 여기에만 있는 금액을 두지 않음(§7-9)",
  "status": "stable",
  "since": "v1.14.0",
  "pack": "commerce",
  "renders": {
    "ember": "assets/components/commerce/cart-summary-lg--ember@2x.png"
  }
}
