{
  "id": "stay-summary-md",
  "name": "Stay Summary / MD",
  "group": "booking",
  "tags": [
    "예약",
    "요약",
    "투숙조건"
  ],
  "spec": {
    "width": "container.max",
    "paddingY": "booking.summaryPaddingY",
    "gap": "booking.barGap",
    "borderWidth": "border.width",
    "labelTypography": "caption",
    "valueTypography": "body1-bold"
  },
  "tokens": {
    "bg": "surface.subtle",
    "border": "border.subtle",
    "label": "text.tertiary",
    "value": "text.primary"
  },
  "responsive": {},
  "states": [
    "default"
  ],
  "usage": "예약 단계 상단에 고른 조건을 고정 표시. 지점·날짜·박수·인원",
  "dont": "여기서 값을 고치게 하지 않음. 고치려면 검색으로 되돌림",
  "status": "stable",
  "since": "v1.13.0",
  "pack": "hotel",
  "renders": {
    "atlas": "assets/components/booking/stay-summary-md--atlas@2x.png",
    "harbor": "assets/components/booking/stay-summary-md--harbor@2x.png",
    "tideland": "assets/components/booking/stay-summary-md--tideland@2x.png",
    "cobalt": "assets/components/booking/stay-summary-md--cobalt@2x.png",
    "noir": "assets/components/booking/stay-summary-md--noir@2x.png",
    "linen": "assets/components/booking/stay-summary-md--linen@2x.png"
  }
}
