{
  "id": "btn-primary-sm",
  "name": "Primary Button / SM",
  "group": "button",
  "tags": [
    "CTA",
    "주요액션",
    "채움형"
  ],
  "spec": {
    "width": "hug",
    "height": "control.sm.height",
    "radius": "sm",
    "paddingX": "control.sm.paddingX",
    "typography": "label"
  },
  "tokens": {
    "bg": "brand.primary",
    "label": "text.inverse"
  },
  "responsive": {},
  "states": [
    "default",
    "hover",
    "pressed",
    "disabled"
  ],
  "usage": "밀도 높은 영역. 툴바·필터 바",
  "dont": "삭제·탈퇴 등 파괴적 액션에는 사용 금지 (btn-danger-md 사용)",
  "status": "stable",
  "since": "v1.0.0",
  "pack": "core",
  "renders": {
    "eluo": "assets/components/button/btn-primary-sm--eluo@2x.png",
    "atlas": "assets/components/button/btn-primary-sm--atlas@2x.png",
    "ember": "assets/components/button/btn-primary-sm--ember@2x.png",
    "harbor": "assets/components/button/btn-primary-sm--harbor@2x.png",
    "tideland": "assets/components/button/btn-primary-sm--tideland@2x.png",
    "cobalt": "assets/components/button/btn-primary-sm--cobalt@2x.png",
    "noir": "assets/components/button/btn-primary-sm--noir@2x.png",
    "linen": "assets/components/button/btn-primary-sm--linen@2x.png"
  }
}
