{
  "id": "cta-band-lg",
  "name": "CTA Band / LG",
  "group": "layout",
  "tags": [
    "CTA",
    "전환",
    "띠"
  ],
  "spec": {
    "width": "container.max",
    "paddingY": "ctaBand.paddingY",
    "gap": "ctaBand.gap",
    "radius": "xl",
    "titleTypography": "heading1",
    "leadTypography": "body1"
  },
  "tokens": {
    "bg": "brand.primary",
    "title": "text.inverse",
    "lead": "text.inverse",
    "actionBg": "surface.default",
    "actionLabel": "text.brand"
  },
  "responsive": {
    "md": "stack"
  },
  "states": [
    "default"
  ],
  "usage": "섹션과 섹션 사이, 또는 페이지 끝의 전환 유도. 한 페이지에 하나",
  "dont": "본문 정보를 여기 넣지 않음. 제목 한 줄·리드 한 줄·버튼 하나까지",
  "status": "stable",
  "since": "v1.8.0",
  "renders": {
    "eluo": "assets/components/layout/cta-band-lg--eluo@2x.png",
    "atlas": "assets/components/layout/cta-band-lg--atlas@2x.png",
    "ember": "assets/components/layout/cta-band-lg--ember@2x.png",
    "harbor": "assets/components/layout/cta-band-lg--harbor@2x.png",
    "tideland": "assets/components/layout/cta-band-lg--tideland@2x.png",
    "cobalt": "assets/components/layout/cta-band-lg--cobalt@2x.png",
    "noir": "assets/components/layout/cta-band-lg--noir@2x.png",
    "linen": "assets/components/layout/cta-band-lg--linen@2x.png"
  }
}
