{
  "id": "price-member-md",
  "name": "Price / Member / MD",
  "group": "booking",
  "tags": [
    "예약",
    "가격",
    "회원가"
  ],
  "spec": {
    "gap": "booking.priceGap",
    "listTypography": "body2",
    "memberTypography": "heading3",
    "noteTypography": "caption"
  },
  "tokens": {
    "listLabel": "text.tertiary",
    "list": "text.secondary",
    "memberLabel": "text.brand",
    "member": "text.brand",
    "note": "text.tertiary"
  },
  "responsive": {},
  "states": [
    "default",
    "회원가 없음"
  ],
  "usage": "일반가와 회원가를 나란히. 회원가를 크고 굵게 둬서 가입 동기를 만듦",
  "dont": "회원가만 단독으로 쓰지 않음 — 비교 대상이 없으면 싼지 알 수 없음. 할인율·정가 구조는 이것이 아니라 price-discount-md",
  "status": "stable",
  "since": "v1.13.0",
  "pack": "hotel",
  "renders": {
    "atlas": "assets/components/booking/price-member-md--atlas@2x.png",
    "harbor": "assets/components/booking/price-member-md--harbor@2x.png",
    "tideland": "assets/components/booking/price-member-md--tideland@2x.png",
    "cobalt": "assets/components/booking/price-member-md--cobalt@2x.png",
    "noir": "assets/components/booking/price-member-md--noir@2x.png",
    "linen": "assets/components/booking/price-member-md--linen@2x.png"
  }
}
