{
  "id": "btn-primary-lg",
  "name": "Primary Button / LG",
  "group": "button",
  "tags": [
    "CTA",
    "주요액션",
    "채움형"
  ],
  "spec": {
    "width": "hug",
    "height": "control.lg.height",
    "radius": "lg",
    "paddingX": "control.lg.paddingX",
    "typography": "body1-bold"
  },
  "tokens": {
    "bg": "brand.primary",
    "label": "text.inverse"
  },
  "responsive": {
    "sm": "fill"
  },
  "states": [
    "default",
    "hover",
    "pressed",
    "disabled"
  ],
  "usage": "화면당 주요 액션 1개. 히어로·폼 제출·전환 유도",
  "dont": "삭제·탈퇴 등 파괴적 액션에는 사용 금지 (btn-danger-md 사용)",
  "status": "stable",
  "since": "v1.0.0",
  "pack": "core",
  "renders": {
    "eluo": "assets/components/button/btn-primary-lg--eluo@2x.png",
    "atlas": "assets/components/button/btn-primary-lg--atlas@2x.png",
    "ember": "assets/components/button/btn-primary-lg--ember@2x.png",
    "harbor": "assets/components/button/btn-primary-lg--harbor@2x.png",
    "tideland": "assets/components/button/btn-primary-lg--tideland@2x.png",
    "cobalt": "assets/components/button/btn-primary-lg--cobalt@2x.png",
    "noir": "assets/components/button/btn-primary-lg--noir@2x.png",
    "linen": "assets/components/button/btn-primary-lg--linen@2x.png"
  }
}
